sentence1,sentence2,label
"যাত্রী বিক্ষোভে হাওড়া স্টেশনে ধুন্ধুমার, আরপিএফের লাঠিচার্জে ক্ষুব্ধ নবান্নর চিঠি রেলকে","কবে থেকে শুরু লোকাল ট্রেন, উত্তর নেই রেলের কাছেও",0
"সৌমিত্র চট্টোপাধ্যায়: মহানায়ক নন, শিল্পী শিরোমণি",প্রথম আলাপেই সৌমিত্রর মধ্যে অপুকে খুঁজে পেয়েছিলেন সত্যজিৎ রায়,0
"কিছু মানুষের জন্য পথ হারিয়ে ছিলেন, ফের বলিউডে ফিরছেন তনুশ্রী দত্ত",মাদক কেলেঙ্কারি: অর্জুন রামপালের দিকে নিশানা,0
শ্রাবন্তীকে বিয়ে করে জীবন ধ্বংস হয়ে গিয়েছে!,"স্বামীর সঙ্গে থাকছেন না শ্রাবন্তী, ভেঙেই যাচ্ছে সংসার!",0
"নির্বাচনে কে বিজয়ী, কখন জানা যাবে?",বাকি ছয়টি রাজ্যের চারটিতেই এগিয়ে বাইডেন,0
ট্রাম্পের বাঁচা–মরা পেনসিলভানিয়ায়,যুক্তরাষ্ট্রে প্রেসিডেন্ট নির্বাচন আজ,0
করোনায় টানা রেকর্ড সংক্রমণ দেখছে বিশ্ব,করোনায় আক্রান্তের সংখ্যা ৪ কোটি ৬৩ লাখ ছাড়িয়েছে,0
মৃত্যুর পর সৌমিত্রের প্রথম ছবি ডিসেম্বরে,মুক্তির আলোয়,0
"সংসদের বিশেষ অধিবেশন শুরু হচ্ছে কাল, চলবে ৮-১০ কার্যদিবস","নতুন সাজে সংসদ, রোববার সন্ধ্যায় বসছে বিশেষ অধিবেশন",0
নেভাদা-পেনসিলভ্যানিয়ায় আরও এগিয়ে 'জয়ের সুবাস' পাচ্ছেন বাইডেন,কে হতে যাচ্ছেন যুক্তরাষ্ট্রের নতুন প্রেসিডেন্ট?,0
মার্কিন পরমাণু অস্ত্র সংস্থার প্রধান লিসা গর্ডনের পদত্যাগ,ট্রাম্প প্রশাসন ছাড়তে কর্মকর্তাদের হিড়িক,0
ড. ফাউসি রাজনীতি করছেন,ফাউসিকে রেখে ট্রাম্পকে বিদায় করতে চান বাইডেন,0
নোয়াখালীতে প্রবাসীর স্ত্রীকে ধর্ষণের অভিযোগে যুবলীগ নেতা গ্রেপ্তার,"প্রবাসীর স্ত্রীকে অস্ত্রের মুখে জিম্মি করে ধর্ষণ, যুবলীগ সভাপতি রিমাণ্ডে",0
নগ্নতার অভিযোগে মিলিন্দ সুমনের বিরুদ্ধে এফআইআর,"অশ্লীলতায় ‘উৎসাহ’, মিলিন্দ সোমানের বিরুদ্ধে অভিযোগ দায়ের গোয়ায়",0
অর্জুনের বাড়িতে ৮ ঘণ্টা তল্লাশি চালিয়ে যা পেলো এনসিবি,এনসিবি দফতরে অর্জুনের গার্লফ্রেন্ড,0
কমেন্ট সেকশন বন্ধ করে দিলেন শ্রাবন্তী,শ্রাবন্তীর কঠোর সিদ্ধান্ত,0
প্রবাসীর স্ত্রীকে অস্ত্রের মুখে ধর্ষণ করে ভিডিও ধারণ,"ঘরে ঢুকে চাচিকে ধর্ষণ করে নগ্ন ছবি ধারণ, যুবলীগ নেতা গ্রেফতার",0
তৃতীয় বিয়েটাও ভাঙতে চলেছে কলকাতার অভিনেত্রী শ্রাবন্তী চট্টোপাধ্যায়ের।,সুসংবাদ দিলেন শ্রাবন্তীর ছেলে!,0
রাশিয়ার করোনা টিকার উৎপাদন করতে পারে ভারত : পুতিন,প্রতিটি ডোজের জন্য ৩২ ডলার থেকে ৩৭ ডলার নেবে মর্ডানা।,0
দৃশ্যম'র অভিনেত্রীকে নিয়ে জল্পনা,"তনুশ্রী দত্তর বোন, অভিনেত্রী ঈশিতা দত্ত কি মা হতে চলেছেন?",0
রানি মুখোপাধ্যায়ের সঙ্গে মেহেন্দিতে অভিনয় করেন ফারাজ খান.,মৃত্যুর সঙ্গে পাঞ্জা লড়ছেন অভিনেতা ফারাজ খান,0
দিল্লি-হায়দরাবাদের ফাইনালে ওঠার লড়াই রাতে,আজ আইপিএলের ধুন্ধুমার লড়াই।,0
ভারতে করোনা আক্রান্তের সংখ্যা ৮১ লাখ ছাড়িয়েছে,বৈশ্বিক মহামারি করোনারাঘাতে মাত্র ১০ মাসেই পৃথিবী ছাড়া প্রায় ১২ লাখ মানুষ,0
পাক অধিকৃত 'গিলগিট-বালতিস্তানকে প্রদেশের মর্যাদা দেওয়ার কথা বললেন ইমরান খান,পাকিস্তানকে অবিলম্বে গিলগিট-বাল্টিস্তান খালি করার নির্দেশ ভারতের,0
৩২তম স্প্যানে দৃশ্যমান পদ্মা সেতুর ৪৮০০ মিটার,পদ্মা সেতুর স্প্যান বসানো স্থগিত,0
বাইডেনকে এখনই অভিনন্দন জানাতে চান না তিনি,যুক্তরাষ্ট্রের নতুন প্রেসিডেন্ট জো বাইডেন,0
এশিয়ার শক্তিশালী ঘূর্ণিঝড় আঘাত হেনেছে ফিলিপাইনে,বিশ্বের সবচেয়ে শক্তিশালী ঘূর্ণিঝড় হতে চলেছে গণি!,0
করোনায় অন্য রকম ভোট,"আবারও ট্রাম্প, নাকি বাইডেন",0
শ্রীমঙ্গলে লাইনচ্যুত ট্রেনের ওয়াগান থেকে তেল লুটপাট,ট্রেন লাইনচ্যুত: সিলেটের সাথে রেল যোগাযোগ বিচ্ছিন্ন,0
মরণোত্তর দেহদান করে সব ধ্বংসের নির্দেশ দিলেন কবীর সুমন,ইচ্ছাপত্রে' যা লিখেছেন কবীর সুমন,0
বিদ্রোহী গুরুংকে কাছে টানতে নারাজ পাহাড়,"‘‌বিমল গুরুং মুর্দাবাদ’‌ স্লোগানে ফের গর্জে উঠল পাহাড়, বিশাল মিছিল কার্শিয়াংয়ে",0
শ্রীলঙ্কা সফরে যাচ্ছে না বাংলাদেশ,শ্রীলঙ্কা সফর স্থগিত করায় ঘরোয়া ক্রিকেট চালু করার চিন্তা বিসিবির,0
জানা গেল শার্লিন ফারজানার অন্তরালে থাকার গল্প,পুত্র সন্তানের মা হয়েছেন শার্লিন ফারজানা,0
ভারতের ৩৬ রানের অলআউটে রেকর্ড ভেঙে চুরমার,"লজ্জার রেকর্ড কোহলিদের, আড়াই দিনেই টেস্ট জিতে নিল অসিরা",0
"চাটখিলে অস্ত্রের মুখে ধর্ষণ: গ্রেপ্তার শরীফ রিমান্ডে, যুবলীগ থেকে বহিষ্কার",নোয়াখালীতে চাচিকে ধর্ষণের অভিযোগে গ্রেফতার যুবক,0
যে লড়াইয়ে এক সঙ্গে লড়তে পারেন মেসি–রোনালদো,"আসল সর্বকালের সেরা'কে ন্যু ক্যাম্পে দেখতে পাবে, বার্সাকে জুভেন্টাস",0
"গোয়া ফরওয়ার্ড পার্টির অভিযোগ করে, চাপোলি ড্যামে অশ্লীল ভিডিও শুট করেছেন পুনম",অশ্লীল ভিডিও শুটিংয়ের অভিযোগে গ্রেপ্তার পুনম পান্ডে,0
"দিল্লির স্বপ্নভঙ্গ, মুম্বাইয়ের পঞ্চম শিরোপা",মুম্বাইকে ১৫৭ রানের লক্ষ্য দিলো দিল্লি,0
বাইডেন শ্বেত ভবনের দোরগোড়ায়,৩০০ ইলেক্টোরাল ভোটের আশা বাইডেনের,0
যুক্তরাষ্ট্রে করোনাভাইরাস টিকা সরবরাহ শুরু ফাইজারের,মডার্নার টিকা নিয়ে ফাউসির উচ্ছ্বাস,0
চট্টগ্রামকে ১৫৬ রানের টার্গেট দিল খুলনা,শ্বাসরুদ্ধকর ফাইনালে খুলনার শিরোপা জয়,0
প্রতিটি ডোজের জন্য ৩২ ডলার থেকে ৩৭ ডলার নেবে মর্ডানা।,কোভিড-১৯: ফাইজারের পর এবার মডার্নার ৯৪.৫% কার্যকর টিকার দাবি,0
"‘গিলগিট-বালটিস্তান বেআইনিভাবে দখল করে রেখেছে পাকিস্তান’, কড়া প্রতিক্রিয়া রাজনাথের",পাকিস্তানকে অবিলম্বে গিলগিট-বাল্টিস্তান খালি করার নির্দেশ ভারতের,0
"এক নজরে জো বাইডেন, যে ধর্মের অনুসারী তিনি","৩২ বছরের সাধনা, স্বপ্নপূরণের ‘পথে’ বাইডেন",0
"জ্বর নেমেছে-অক্সিজেনের মাত্রা স্বাভাবিক, আগের থেকে একটু ভাল দিলীপ ঘোষ","দিলীপ ঘোষের জ্বর কমেছে, ফুসফুসে সমস্যা হওয়ায় সিটি স্ক্যান বিজেপির রাজ্য সভাপতির",0
"সুপারশপ উদ্বোধনে সাকিব, আলোচনা-সমালোচনা",রাতে বিদেশ থেকে ফিরে সকালেই জনসমাগমে সাকিব,0
রোহিঙ্গা ইস্যুতে কার কী অবস্থান,মিয়ানমারে নির্বাচন : অং সান সু চি কী আবারো জিতবেন?,0
ঘরে ঢুকে প্রবাসীর স্ত্রীকে ধর্ষণ মামলায় যুবলীগ নেতা রিমান্ডে,নোয়াখালীতে সেই যুবলীগ নেতার বাড়ি থেকে অস্ত্র উদ্ধার,0
নামাজ পড়তে অসুবিধা হওয়ায় অভিনয় ছেড়েছেন চিত্রনায়িকা,অভিনয় ছেড়ে দিলেন নায়িকা মুক্তি,0
পরিসংখ্যানে বাংলাদেশের অভিষেক টেস্ট,টেস্ট অভিষেকের ২০ বছর পর বাংলাদেশের কী অবস্থা,0
লোকাল ট্রেন চালানোর জন্য আলোচনা চেয়ে রাজ্যের চিঠি রেলকে,"যাত্রী বিক্ষোভে হাওড়া স্টেশনে ধুন্ধুমার, আরপিএফের লাঠিচার্জে ক্ষুব্ধ নবান্নর চিঠি রেলকে",0
শর্ট সার্কিটের আগুনে দগ্ধ ৯,চট্টগ্রামে বৈদ্যুতিক শর্ট সার্কিটের আগুনে দগ্ধ ৬,0
বিব্রত ও বিরক্ত তৌকীর আহমেদ,যুক্তরাষ্ট্রে স্থায়ী হওয়া নিয়ে যা বললেন তৌকীর,0
ডিন জোন্স আর নেই! স্তম্ভিত ক্রিকেটবিশ্ব!,"প্রশংসা কুড়িয়েছেন সারাজীবন, মৃত্যুর আগের দিন ডিন জোন্স শুনলেন তিনি ‘বিরক্তিকর’",0
মার্কিন নির্বাচনে আলোচিত ইলেক্টোরাল কলেজ পদ্ধতি কী?,সোনার হরিণ ২৭০ ইলেক্টোরাল ভোট,0
কালীপুজোর আগেই লোকাল ট্রেন চালু হতে পারে রাজ্য.,"স্বাস্থ্য বিধি মেনে লোকাল চালাতে প্রস্তুত, রাজ্যকে চিঠি রেলের",0
"দেশে ফিরে সাকিব বললেন, ভালোবাসার প্রতিদান দিতে চান",যুক্তরাষ্ট্র থেকে দেশে ফিরলেন সাকিব,0
"নিটে ৭২০-তে ৭২০, রেকর্ড ওডিসার শোয়েব আফতাবের।","নিট পরীক্ষায় ৭২০/৭২০ পেয়েও প্রথম হওয়া হল না দিল্লির আকাঙ্ক্ষার, জেনে নিন কারণ",0
ইথিওপিয়ার মানুষ প্রাণ বাঁচাতে দেশ ছেড়ে পালাচ্ছেন,ইথিওপিয়ায় চরম মানবিক সংকট সৃষ্টি হচ্ছে: ইউএনএইচসিআর,0
বিয়ের জন্মদিনে দীপিকাকে 'গুড়িয়া' বললেন রণবীর,বিবাহবার্ষিকীতে দীপিকাকে নিয়ে রোমান্টিক রণবীর,0
‘চুক্তির নায়িকা’ পিয়ার নতুন ছবি টগর,"পূর্ণ নয়, স্বল্পতে ফিরলেন পিয়া বিপাশা",0
নতুন সিনেমায় অপু বিশ্বাস,আবার এক হচ্ছেন বাপ্পী-অপু,0
বিশ্বে করোনায় আক্রান্ত ছাড়াল ৪ কোটি ৬৮ লাখ,"দেশে একদিনে মৃত্যুতে স্থিতি, বেড়েছে আক্রান্তের হার",0
"চট্টগ্রামে নামতে পারে বৃষ্টি, এরপর জেঁকে বসবে শীত",নতুন খবর দিল আবহাওয়া অধিদফতর,0
করোনার টিকা নিয়ে মডার্না ও ফাইজারের সামনে চ্যালেঞ্জ,"এবার ফাইজারের দাবি, তাদের টিকা ৯৫% কার্যকর",0
আইসোলেশনে সালমান খান,সালমান খানের করোনা নেগেটিভ,0
"জ্বর নেমেছে-অক্সিজেনের মাত্রা স্বাভাবিক, আগের থেকে একটু ভাল দিলীপ ঘোষ","জ্বর একটু নেমেছে, কো মর্বিডিটি নেই, তবু এইচডিইউ-তেই করোনা আক্রান্ত দিলীপ ঘোষ",0
৪ মাস পর বসল পদ্মা সেতুর ৩২তম স্প্যান,৩২তম স্প্যানে দৃশ্যমান পদ্মা সেতুর ৪৮০০ মিটার,0
বিজ্ঞাপনে সুশান্তকে ব্যঙ্গ করেছেন রণবীর সিং!,সুশান্তকে অপমান করায় রণভীরকে বয়কটের ডাক,0
১১ দিনে ৫০ লক্ষ দর্শক দেখলেন সানগ্লাস!,"ভিন্ন গল্পে নিশো-মেহজাবীন, মিলছে প্রশংসা",0
ট্রাম্প যেভাবে জয়ী হতে পারেন,ট্রাম্প সমর্থকেরা এখনো যে কারণে আশাবাদী,0
পদ্মা সেতুর ৫ হাজার ৭০০ মিটার দৃশ্যমান,পদ্মা সেতুতে বসছে ৩৮তম স্প্যান,0
মাহমুদউল্লাহর শেষের ঝড়ে লড়াইয়ের পুঁজি পেল খুলনা,রুদ্ধশ্বাস জয়ে বঙ্গবন্ধু টি-টোয়েন্টি কাপে চ্যাম্পিয়ন খুলনা,0
প্রথম দেখায় দীপিকাকে ‘বিয়ে করেছিলেন’ রণবীর,রণবীর-দীপিকার দ্বিতীয় বিবাহবার্ষিকী,0
"বিপ টেস্টে অকৃতকার্য নাসির, খেলতে পারবেন না টি-২০ কাপে","ফিটনেসে চমকে দিলেন এনামুল, আশরাফুল, নাফীসরা",0
বিজিবিকে দেশের সার্বভৌমত্ব রক্ষায় বঙ্গবন্ধুর নির্দেশনা অনুসরণের আহবান,বিজিবি আজ থেকে ত্রিমাত্রিক বাহিনীতে রূপান্তরিত : প্রধানমন্ত্রী,0
"ফেসবুকে অস্ত্র হাতে ছবি, আলোচনায় এমপি বাবলু",এমপি বাবলুর ফেসবুকে নগ্ন ছবি,0
দ্বিতীয় অনুশীলন ম্যাচেও তামিমের ব্যাটিং ঝলকে জিতল 'বি' দল,"ফের বিধ্বংসী তানজিদ, কম গেলেন না আকবরও",0
বাইডেন-ট্রাম্পের ভোটের ব্যবধান বাড়ছেই,জাতির উদ্দেশ্যে আজ ভাষণ দেবেন জো বাইডেন,0
"মৃত্যু ১১ লাখ ৫৩ হাজার, আক্রান্ত ৪ কোটি ৩০ লাখের বেশি","যুক্তরাষ্ট্রে করোনা মহামারি আবার তীব্র,আক্রান্তের সংখ্যা একদিনে এক লাখ ছাড়িয়েছে",0
পূজা দিতে গিয়ে ‘আদালত অবমাননা’ করেছেন সৃজিত-মিথিলা!,"‘নিষিদ্ধ জোনে’ সৃজিত-মিথিলা, পেতে পারেন আইনি নোটিশ",0
মেসির বার্সার সামনে রোনালদোহীন জুভেন্টাস সাদামাটাই,চ্যাম্পিয়নস লিগে জুভেন্টাসকে ২-০ গোলে হারিয়েছে বার্সেলোনা।,0
করোনা আবহে খবরের শিরোনামে থাকতেই কি সম্পূর্ণ নগ্ন হয়ে সমুদ্র সৈকতে ছবি তুললেন এই সেলিব্রিটি?,সৈকতে নগ্ন দৌড়ের পর ফের ভাইরাল মিলিন্দের সঙ্গে স্ত্রীর ছবি,0
"করোনায় মৃত্যু ১৮, শনাক্ত ১৪৭৪",দেশে আবার বাড়ল করোনায় মৃত্যু ও শনাক্ত,0
মুসলিমদের নিয়ে ম্যাক্রোঁর মন্তব্যকে সমর্থন আমিরাতি মন্ত্রীর,মুসলিমদের অনুভূতি বুঝতে পারছি: ম্যাক্রোঁ,0
রোহিঙ্গাদের ছাড়াই মিয়ানমারে নির্বাচন আজ,মিয়ানমারে নির্বাচনে ভোটগ্রহণ চলছে,0
ট্রোলিং সহ্য করতে না পেরেই কি চরম সিদ্ধান্ত শ্রাবন্তীর,কমেন্ট সেকশন বন্ধ করে দিলেন শ্রাবন্তী,0
সৌমিত্রের আদি বাড়ি ছিল কুষ্টিয়ার কয়া গ্রাম,সত্যজিত রায়ের অপু যেভাবে ফেলুদা হয়ে উঠলেন,0
"ব্রাজিল-আর্জেন্টিনার জয়, হ্যাট্রিক করে নেইমারের ইতিহাস",নেইমারের হ্যাটট্রিকে পেরু জয় ব্রাজিলের,0
বাধা পেরিয়ে অপু,যে কারণে ১০ কেজি ওজন কমালেন অপু বিশ্বাস,0
ভারতীয় ক্রিকেটার' পরিচয় মুছে ফেলেছেন রোহিত!,‘দলের ভেতর রাজনীতি; কোহলি সবচেয়ে স্বার্থপর ক্রিকেটার’,0
শত ব্যস্ততার মাঝে এক টুকরো অবসরে,অবসরে সেলাই ও মাছ ধরেন প্রধানমন্ত্রী',0
মাদক কেলেঙ্কারিতে জেরার মুখোমুখি অর্জুন রামপাল,অর্জুনের বাড়িতে ৮ ঘণ্টা তল্লাশি চালিয়ে যা পেলো এনসিবি,0
মার্কিন প্রেসিডেন্ট নির্বাচন নিয়ে ডয়েচ ভেলের নানা তথ্য,আমেরিকা নির্বাচন ২০২০: ডোনাল্ড ট্রাম্প-জো বাইডেনের যে বিষয়গুলি আপনি জানতে চান,0
কাজলের বিয়ের ছবি ভাইরাল,সাত পাকে বাঁধা পড়লেন কাজল,0
রণবীরকে বিয়ে করা প্রসঙ্গে মুখ খুললেন দীপিকা,বিবাহবার্ষিকীতে দীপিকাকে নিয়ে রোমান্টিক রণবীর,0
৩৫ সেকেন্ডে ধ্বংসস্তূপ তুরস্কের ইজমির,"ভূমিকম্পের ১৮ ঘন্টা পর তুরস্কে ৩ সন্তানসহ মাকে উদ্ধার, নিহত ২৮",0
জন্মদিনে ​গোয়ায় গিয়ে নগ্ন হয়ে দৌড়েছিলেন ভারতীয় অভিনেতা মডেল মিলিন্দ সোমান।,"গোয়ার সমুদ্র সৈকতে পোশাকহীন দৌড়ের ছবি পোস্ট, অশ্লীলতার দায়ে মিলিন্দ সোমানের বিরুদ্ধে মামলা",0
