sentence1,sentence2,label
"তৎকালীন কংগ্রেস সরকারের পিএম ফান্ডের টাকা ‘‌রাজীব গান্ধী ফাউন্ডেশন’–এর ঝুলিতে গিয়ে ঢুকত,‌ অভিযোগ নাড্ডার",প্রধানমন্ত্রী ত্রাণ তহবিলের টাকা গরিবদের বদলে রাজীব গান্ধী ফাউন্ডেশনে দিত কংগ্রেসঃ জেপি নাড্ডা,1
কিন্তু অবস্থা এখানেও ভালো মনে হচ্ছে না।,তবে এখানে আগের মতো পরিস্থিতি নেই।,1
''কেবলমাত্র তাদের মধ্যের তোমার খাঁটি বান্দাদের ব্যতীত।’’,"তবে তাদের মধ্যে যারা আপনার খাঁটি বান্দা, তাদেরকে ছাড়া।",1
ভাবিয়া না পাই কিছু ইহার উপায়।,আমি তো কোনো উপায় ভেবে পাচ্ছি নে।,1
তাহলে কথা দিয়েও নেই কেন মুখ্যমন্ত্রী?,"প্রধানমন্ত্রী কেন বিবৃতি দিচ্ছেন না, সেটাই আশ্চর্যের।",1
"হিন্দি, উর্দু, মরাঠি, কন্নড়, তামিল, মালয়ালম, ইংরেজি, বাংলা ও ওড়িয়া ভাষার প্রতিযোগীরা এই প্রতিযোগিতা উৎসবে যোগদান করেন।","হিন্দি, ইংরেজি, উর্দু, গুজরাতি, মারাঠি, ওড়িয়া, বাংলা, অসমিয়া, তেলেগু, তামিল ও কন্নড় ভাষায় পরীক্ষা নেওয়া হয়েছিল।",1
''লুতের অনুবর্তীরা ব্যতীত। নিঃসন্দেহ তাঁদের সবাইকে আমরা অবশ্যই উদ্ধার করব --,কিন্তু লূতের পরিবার-পরিজন। আমরা অবশ্যই তাদের সবাইকে বাঁচিয়ে নেব।,1
আর আমি এভাবেই বড় হয়েছি।,আর ওভাবেই আমার বেড়ে ওঠা।,1
বাবা এবং মা দুজনেই যিহোবাকে অনুগতভাবে সেবা করার বিষয়ে ডরিস দিদি এবং আমার জন্য এক উত্তম উদাহরণ স্থাপন করে।,বাপ্তিস্ম এবং পূর্ণসময়ের পরিচর্যা,1
গ্রেফতার করা হল গাড়িতে থাকা চার দুষ্কৃতীকে।,ফাঁসিতে ঝুলিয়ে দেওয়া হয়েছে নির্ভয়ার চার অপরাধীকে।,1
উইপোকা এদের কাছে প্রিয় খাদ্য।,শূকরের মাংস তাদের অতি প্রিয়।,1
আমরা সবাই মিলে তাঁর টেককেয়ার করছি।,আমাদের সবার সমর্থন তাঁর সঙ্গে আছে।,1
প্রতীক্ষিত,অপেক্ষিত,1
মনে হচ্ছে পুরনো শত্রুতার জেরেই খুন।,মনে হয় পুরনো কোনও শত্রুতার জেরে ওঁকে খুন করা হল।,1
"বস্তুতঃ আমরা তাদের কাছে সত্য নিয়ে এসেছি, কিন্ত তারা তো নিশ্চয়ই মিথ্যাবাদী।","কিছুই নয়, আমি তাদের কাছে সত্য পৌঁছিয়েছি, আর তারা তো মিথ্যাবাদী।",1
ফোল্ডার- এর নাম:,ফোল্ডারের নাম লিখুন:,1
নিহত জওয়ানদের পরিবারকে সমবেদনা জানাই।,আর নিহতদের পরিবার-পরিজনের জন্য সমবেদনা।,1
টিটুকে সবাই ভালবাসে ওরা।,টেডি বিয়ার ভালোবাসে সবাই।,1
বেশি হলে ভাল।,আরও হলে ভালো হয়।,1
"বলুন, সত্য আগমন করেছে এবং অসত্য না পারে নতুন কিছু সৃজন করতে এবং না পারে পূনঃ প্রত্যাবর্তিত হতে।","তুমি বলো -- ''সত্য এসেই গেছে, আর মিথ্যার উৎপত্তি হবে না, আর এর পুনরুদ্ভবও হবে না।’’",1
রইসে শাহরুখ খানের স্টিল ছবি দেখুন,কামব্যাক ছবি নিয়ে চিন্তায় আছেন শাহরুখ খান,1
১৪. কীভাবে এক বিনয়ী মনোভাব যেকোনো পরিস্থিতিতে আমাদের সন্তুষ্ট ও আনন্দিত থাকতে সাহায্য করে?,"৮: ৩০, ৩১) একজন বিনয়ী ব্যক্তি মণ্ডলীতে তার কার্যভার ও দায়িত্ব নিয়ে সন্তুষ্ট থাকেন ।",1
"আর এই যে মসজিদগুলো হচ্ছে আল্লাহ্‌র জন্য, সুতরাং তোমরা আল্লাহ্‌র সঙ্গে আর কাউকেও ডেকো না।","এবং এই ওহীও করা হয়েছে যে, মসজিদসমূহ আল্লাহ তা’আলাকে স্মরণ করার জন্য। অতএব, তোমরা আল্লাহ তা’আলার সাথে কাউকে ডেকো না।",1
মার্কিন যুক্তরাষ্ট্রে র টেক্সাসের ঘটনা।,ঘটনাটি আমেরিকার টেক্সাসের।,1
"আর আমাদের তরফ থেকে সহৃদয়তা ও পবিত্রতা। আর তিনি ছিলেন ধর্মপরায়ণ,",এবং নিজের পক্ষ থেকে আগ্রহ ও পবিত্রতা দিয়েছি। সে ছিল পরহেযগার।,1
আমার এমন চরিত্রে কাজ করতেই বেশি ভালো লাগে।,এই ধরনের একটি চরিত্রে অভিনয় করে বেশ লেগেছে আমার।,1
এত সড়ক দিয়ে কী হবে।,রাস্তায় বেরিয়ে কী হবে?,1
বিচার বিভাগ তো স্বাধীন।,বিচার ব্যবস্থা স্বাধীন হবে।,1
কিন্তু পরে দু’জনেই সেই সম্পর্ক থেকে বেরিয়ে আসেন।,তবে পরে ঝামেলা হওয়ায় দুজনে আলাদা হয়ে যায়।,1
তার পর বাকি সব।,পরে অন্য সবকিছু।,1
প্রসঙ্গত হামলায় নিহতের পরিবারের সদস্যরা লাশ নিতে অস্বীকৃতি জানায়।,এরপরেই মৃতার পরিবার তাঁর দেহ নিতে অস্বীকার করে।,1
সুপ্রকাশ চক্রবর্তী ও দেবজিৎ ভট্টাচার্য,দেবর্ষি চক্রবর্তী ও দেবজিৎ ঠাকুর,1
"শ্রীনগর, ৬ অক্টোবর : জম্মু ও কাশ্মীরের সেনা ক্যাম্পে ফের হামলা চালাল জঙ্গিরা।","শ্রীনগর, ১০ অক্টোবর : ফের জঙ্গিদের হামলার নিশানায় জম্মু ও কাশ্মীর।",1
আমরাই উন্নয়ন দেখিয়ে দেব।,আমরা উন্নয়ন করিয়ে দেখিয়ে দেব।,1
এবার আম্পায়ারকে গালি দিয়ে শাস্তি সাকিবের,আম্পায়ারের সিদ্ধান্তে অসন্তোষ প্রকাশ করায় সাকিবকে জরিমানা,1
"তার অন্যান্য নৈমিত্তিক কৌতূহলের মধ্যে ড্রাগস্টোর আইসক্রিম, ভাল খাদ্য,পুরনো দালানকোঠা, এবং তার স্ত্রীর সাথে বাগান করা অন্তর্ভুক্ত ছিল।","তাঁর অন্যান্য নৈমিত্তিক কৌতূহলের মধ্যে ড্রাগস্টোর আইসক্রিম, ভাল খাদ্য,পুরনো দালানকোঠা, এবং তাঁর স্ত্রীর সাথে বাগান করা অন্তর্ভুক্ত ছিল।",1
খুচরো টাকা নেই হাতে।,আমজনতার হাতে টাকা আসে না।,1
আইপিএল নিলাম ২০২০ : ট্রফি জয়ই লক্ষ্য দিল্লি ক্যাপিটালসের,"আইপিএল নিলাম ২০২০ : ট্রফি জয়ই লক্ষ্য দিল্লি ক্যাপিটালসের, শ্রেয়স-পন্থ-রাহানেরা ভরসা",1
চাকরি দিতে পারেননি।,হয়তো চাকরি দিতে পারিনি।,1
কথাটার অর্থ কি?,এটা বলার দ্বারা তিনি কী বুঝাতে চেয়েছেন?,1
আমাদের কাছে ভারত অত্যন্ত গুরুত্বপূর্ণ।,ভূরাজনৈতিক বিষয়ে ভারত আমাদের জন্য বড় বিষয়।,1
আমাদের কোনও উৎসাহও নেই।,আমাদের কোনো চাপ কাজ করছে না।,1
তখন এই এলাকা ছিল জঙ্গলে ঢাকা ।,সেই সময় এই এলাকায় জঙ্গল ছিল।,1
আমি তাতে স্থাপন করেছি মজবুত সুউচ্চ পর্বতমালা এবং পান করিয়েছি তোমাদেরকে তৃষ্ণা নিবারণকারী সুপেয় পানি।,"আর তাতেই তো আমরা বানিয়েছি উঁচু পাহাড়-পর্বত, আর তোমাদের পান করতে দিয়েছি সুপেয় পানি?",1
এর আগে বলিউডে নিজের এমন ছবি সোশাল মিডিয়ায় পোস্ট করেছেন সোনম কাপুর।,সদ্যই সোনাম কপূর তাঁকে বিদ্রুপের কিছু স্ক্রিন শট সোশ্যাল মিডিয়ায় শেয়ার করেছেন।,1
দুর্ঘটনার পর তিনি ওই সফর বাতিল করেছেন।,এ ঘটনার পর ছুটি সংক্ষিপ্ত করেন তিনি।,1
এতে সেখানে বিশৃঙ্খল পরিবেশ সৃষ্টি হয়।,এটি ভীতিকর একটি পরিবেশ তৈরি করে দিচ্ছে।,1
সবচেয়ে প্রথম যে-সভায় যোগ দিই সেখানে প্রথম বারের মতো রাস্তায় সাক্ষ্যদান করার কথা ঘোষণা করা হয়।,১৯৪০ সালের জুন মাসে আমি ব্রিস্টল শহরে বাপ্তিস্ম নিই ।,1
এক নারীর বীরত্বের কাহিনি।,ধারাবাহিকে মহিলা সেনার গল্প,1
তারপরেও দলের খেলা শুধরোয়নি।,তার পরও অপ্রতিরোধ্য লেগেছে দলকে।,1
"যাইহোক, মালদ্বীপের ছোটোখাটো বাজার শেয়ার এটিকে সামগ্রিক ভরযুক্ত তালিকার নিচে কাছাকাছিতে রাখে।","যাইহোক, মালদ্বীপের ছোটখাট বাজার শেয়ার এটিকে সামগ্রিক ভরযুক্ত তালিকার নীচে কাছাকাছিতে রাখে।",1
"এই বছরটি আরও গুরুত্বপূর্ণ এই কারনে যে বিশ্ব স্বাস্থ্য সংস্থা (হু), নার্স ও ধাত্রীদের বছর হিসাবে বছরটিকে ঘোষনা করেছে।","""তিনি সমগ্র সেবিকা সমাজের প্রতি বলেন, """"দিন যতই কঠিন হোক না কেন অসুস্থ মানুষদের প্রতি আপনাদের করুণা, আত্মোৎসর্গ এবং নিরাময়ের স্পর্শ দিয়ে পরিস্থিতি সামাল দেওয়ার প্রচেষ্টার জন্য আপনাদের ধন্যবাদ""""।""",1
পঞ্চম শ্রেণিতে অধ্যয়নকালেই তিনি কবিতা লেখা শুরু করেন। সপ্তম শ্রেণিতে অধ্যয়নকালে তিনি 'আশা' শিরোনামে দীর্ঘ এক কবিতা লেখেন।,সপ্তম শ্রেণিতে অধ্যয়নকালে তিনি 'আশা' শিরোনামে দীর্ঘ এক কবিতা লেখেন।,1
আর এ ভ্যাপসা গরম আরও কয়েক দিন থাকবে বলে জানিয়েছে আবহাওয়া অধিদপ্তর।,আগামী কয়েকদিনও তাপপ্রবাহ চলবে বলেই সতর্কবার্তা জারি করেছে হাওয়া অফিস।,1
কোম্পানির তরফ থেকে এ তথ্য নিশ্চিত করা হয়েছে।,এমনটাই সংস্থার তরফে জানানো হয়েছিল।,1
পরেই রয়েছে বিজেপি।,পিছনে বিজেপিরও মদত আছে।,1
একবারও ভাবল না।,"কখনো তোমার ক’রে, তোমাকে ভাবিনি।",1
"মেয়ে বলল, না না, ও আমার মাম্মি নয়।","তিনি বলেন, আমার মেয়ে ফেল করেনি।",1
তবে বাস্তবতা বিবর্জিত হলেও চলবে না।,"কিন্তু, সত্যিটা পরিবর্তন হচ্ছে না।",1
বিদেশে চলে যেতে চায়।,তারা তো বেরিয়ে পড়তে চান দেশ ভ্রমণে।,1
এই স্কুলটিতে দুটি সমৃদ্ধ লাইব্রেরি আছে।,এই বিদ্যালয়টিতে দুটি সমৃদ্ধ গ্রন্থাগার আছে।,1
আমাদের গ্রুপটা কঠিন।,‘‌আমাদের গ্রুপে সত্যিই অন্য দলগুলো এখানে অনেক শক্তিশালী ছিল।,1
পিআইবি-র ফ্যাক্টচেক ট্যুইট সংক্রান্ত ৫টি খবর আজ সরকারি সংস্করণে অন্তর্ভুক্ত হয়েছে সোশ্যাল মিডিয়ায় বিভ্রান্তিকর খবর প্রচার রুখতে এবং বিভ্রান্তিকর খবর প্রচার সম্পর্কে মহামান্য সুপ্রিম কোর্টের উপলব্ধির প্রেক্ষিতে পিআইবি সোশ্যাল মিডিয়ায় ছড়িয়ে পড়া গুজব দূর করতে পৃথক ইউনিট গড়ে তুলেছে।,কোরোপোরেসন অসিনা লাইচৎ লৈবা মফমশিংগী াংমদা দোক্কিং স্তেসনশিং শেমগৎলে ।,1
তাত্ত্বিক দিক থেকে দেখলে সেটা সম্ভব।,অন্তত তাত্ত্বিকভাবে দেখা যাচ্ছে যে এটা সম্ভব।,1
"( গীতসংহিতা ৪০: ১, ২) সত্যিই, তাঁর বাক্যের মাধ্যমে জোগানো শক্তির দ্বারা যিহোবা এখনই “অবনত সকলকে উত্থাপন করেন । ”","সেই সভাগুলোতে তিনি যা শিখতেন, তার দ্বারা উৎসাহিত হয়ে তিনি তার বাড়ির সামনে দিয়ে যান এমন যেকারোর কাছে বাইবেল সাহিত্যাদি অর্পণ করতে শুরু করেন।",1
তাঁরা সবাই একই রকম মতামত দিয়েছেন।,তাঁদের ধারণা অনেকটা একরকমও।,1
আরহঠাৎকরেইনেটওয়ার্কেরকিছু অংশডাউনহয়েগেছে,আর হঠাৎ করেই নেটওয়ার্কের কিছু অংশ ডাউন হয়ে গেছে,1
এই বার্তা প্রধানমন্ত্রী নিজে তাঁর টুইটারে জানিয়েছেন।,এদিন এক টুইট বার্তায় সে খবর প্রকাশের আনেন প্রধানমন্ত্রী নিজেই।,1
গত ডিসেম্বরে পাঞ্জাব ও হরিয়ানা হাইকোর্টের রায়ই বহাল রাখে সুপ্রিম কোর্ট।,গত বছরের ডিসেম্বরে পঞ্জাব ও হরিয়ানা হাইকোর্টের রায়ই বহাল রাখে সুপ্রিম কোর্ট।,1
রয়েছে বিভিন্ন প্রজাতিক কাকাতুয়া।,রয়েছে নানান ধরনের কিটো।,1
"নিঃসন্দেহ ফিরিশ্‌তারা যাদের মৃত্যু আনয়ন করে যারা ছিল নিজেদের প্রতি অন্যায়কারী, তারা বলবে -- ''তোমরা কি অবস্থায় পড়ে রয়েছিলে?’’ তারা বলবে -- ''আমরা দুনিয়াতে দুর্বল ছিলাম।’’ তারা বলবে -- ''আল্লাহ্‌র পৃথিবী কি প্রশস্ত ছিল না যার ফলে তাতে তোমরা হিজরত করতে পারতে?’’ কাজেই এরা -- এদের বাসস্থান জাহান্নাম, আর মন্দ সেই আশ্রয়স্থল","এগুলো তাঁর পক্ষ থেকে পদমর্যাদা, ক্ষমা ও করুণা. আল্লাহ ক্ষমাশীল ও করুণাময়।",1
এই কর্মসূচির মাধ্যমে ৫০ কোটি দরিদ্র মানুষকে বছরে ৫ লক্ষ টাকা পর্যন্ত বিনামূল্যে চিকিৎসা দেওয়া হচ্ছে।,এই কর্মসূচির আওতায় ৫০ কোটি দরিদ্র মানুষ নিখরচায় বার্ষিক ৫ লক্ষ টাকা পর্যন্ত চিকিৎসার সুযোগ-সুবিধা পাচ্ছেন।,1
এই টুর্নামেন্ট থেকে তাঁকে বহিষ্কার করা হয়েছে।,তিনি টুর্নামেন্ট থেকে ছিটকে যান।,1
যে ঘটনায় একাধিক আহত সহ এক যুবকের মৃত্যু হয়েছে।,এই দুৰ্ঘটনাত থিতাতে নিহত হয় এজন কিশোৰ।,1
"উত্তরে সে বলল, ‘আমার বাবা মারা গিয়েছেন’।","জবাবে তিনি জানান, ছেলে মারা গেছে।",1
ছবিটিকে অনেকে লাইকও করেন।,অনেকেই সমালোচনা করেছিলেন সেই ছবির।,1
সব গেলো কোথায় আজ?,"‘কী রে, কোথায় তুই?",1
তার আগে খারাপ খবর।,খারাপ খবরটাই আগে বলে।,1
তারা সেদিকে গেলেন।,তাঁদের ইচ্ছে হয়েছে সে জন্য গিয়েছেন।,1
বললেন‘সত্যি আমি ভাগ্যবান।,"এ বিষয়ে তিনি বলেন, আমি খুব ভাগ্যবান অবশ্যই।",1
"যদি আপনি একটা অর্কিডকে যত্ন নিয়ে বড় করতে চান কিন্তু এই ভেবে চিন্তিত হয়ে থাকেন যে এটা হয়তো শুকিয়ে যাবে, তা হলে আপনি সম্ভবত নিরুৎসাহিত হতে পারেন।",এই পরিস্থিতিতে সত্যিই কি সন্তানদের সফলভাবে মানুষ করা সম্ভব?,1
তবে ইন্দোনেশিয়ার একটি অঞ্চলে বিষয়টি একটু আলাদা।,তবে ইতালিতে কোনো কোনো ক্ষেত্রে বিষয়টি একটু ভিন্ন।,1
মণ্ডলীর কেউ কেউ তাদের দৃষ্টিভঙ্গি জানানোর ক্ষেত্রে স্পষ্টবাদী ছিল এবং ভুল মতবাদগুলো শিক্ষা দিচ্ছিল।,"আপনার সাক্ষাতের কারণ সম্বন্ধে বলার সুযোগ পাওয়ার আগেই যখন বলা হয় যে, “আমি আগ্রহী নই, ” তখন আপনি কী বলতে পারেন? ৫, ৬.",1
ফলে প্রশ্ন ফাঁস হওয়ার কোনো সম্ভাবনা থাকবে না।,ফলে প্রশ্নপত্র ফাঁসের কোনও সুযোগ নেই।,1
খুবই উৎসাহমূলক ও লোমখাড়া করে দেয় এমন একটি সিনেমা।,খুবই অনুপ্রেরণাদায়ক ও মনমাতানো ছবি।,1
এঁদের জন্য নয়।,তাদের পক্ষে নেই।,1
"তিনি লিখেছিলেন, “অনেক মানুষ এখনও লকডাউন বিষয়টিকে গুরুত্ব দিচ্ছেন না।",“অনেকেই লকডাউনকে গুরুত্ব দিচ্ছে না।,1
হাজার হাজার লোক শেষ শ্রদ্ধা জানাতে তার বাড়িতে যায়।,হাজার হাজার লোক শেষ শ্রদ্ধা জানাতে তাঁর বাড়িতে আসেন।,1
কিন্তু একেবারে মৌনব্রত নেওয়ার দরকার পড়ত না।,তবে তা নিয়ে আত্মতুষ্ট হওয়ার প্রয়োজন নেই।,1
