sentence1,sentence2,label
বিজিবি এয়ার উইংয়ের আত্মপ্রকাশ,বিজিবি সদস্যরা এখন জলে স্থলে ও আকাশপথে বিচরণ করবেন: প্রধানমন্ত্রী,0
চার মাস পর পদ্মা সেতুতে বসছে নতুন স্প্যান,দৃশ্যমান হলো প্রায় ৫ কিলোমিটার পদ্মা সেতু,0
পাকিস্তান কেন বারবার এভাবে রান আউট হয়?,ঘরের মাঠে ক্রিকেট ফিরিয়ে পাকিস্তান করল ২৮১,0
চ্যাম্পিয়ন মুম্বাইয়ের অ্যাকাউন্টে ২০ কোটি রুপি,আইপিএলে কে কী পুরস্কার পেলেন দেখে নিন,0
শ্রাবন্তীর সংসার ভাঙার গুঞ্জনে ছেলের 'রহস্যময়' পোস্ট,"শ্রাবন্তীর জীবনে ফের চমক, বিবাহবিচ্ছেদের গুঞ্জনের মাঝেই নয়া ইনিংসের কথা জানালেন অভিনেত্রী",0
যেভাবে এবারো জিতে যেতে পারেন ট্রাম্প,ট্রাম্প সমর্থকেরা এখনো যে কারণে আশাবাদী,0
গত ২৪ ঘণ্টায় বিশ্বে করোনায় রেকর্ড মৃত্যু,সংক্রমণ শুরুর পর এখন পর্যন্ত করোনাভাইরাস মহামারিতে মৃত্যু ১২ লাখ ছাড়িয়েছে।,0
সতীর্থদের নিজের বিমানে আর্জেন্টিনায় নিয়ে গেছেন মেসি,মেসির বিমানে সুয়ারেজ,0
১৪৮ পিস ইয়াবাসহ পুলিশের এএসআই গ্রেপ্তার,র‌্যাবের হাতে ইয়াবাসহ আটক পুলিশ সদস্যের বিরুদ্ধে মামলা,0
একজন সেলসম্যানের ঘর থেকে হোয়াইট হাউসের পথে বাইডেন,কে এই জো বাইডেন,0
"নামছে পারদ, নভেম্বরেই রাজ্যজুড়ে শীতের আমেজ",রবিবার কলকাতার সর্বনিম্ন তাপমাত্রা ১৮.৩ ডিগ্রি সেলসিয়াস।,0
বাইডেনকে রাষ্ট্রপতি ও প্রধানমন্ত্রীর অভিনন্দন,বাইডেন-কমলাকে বিএনপির অভিনন্দন,0
"এক নজরে জো বাইডেন, যে ধর্মের অনুসারী তিনি",স্ত্রী-সন্তানকে হারিয়ে রাজনীতি ছেড়ে দিতে চেয়েছিলেন বাইডেন,0
বার্সেলোনার সামনে রোনালদোহীন জুভেন্টাস,মেসি-দেম্বেলের গোলে জুভেন্টাসের বিপক্ষে বার্সার দারুণ জয়,0
জর্জিয়ায় ভোট পুনঃ গণনা হবে 'যখন',জর্জিয়ায়ও ট্রাম্পের ঘাড়ে নিশ্বাস ফেলছেন বাইডেন,0
গত ২৪ ঘণ্টায় বিশ্বে করোনায় রেকর্ড মৃত্যু,করোনায় মৃত্যু ১২ লাখ ছাড়াল,0
"সাত পাকে বাঁধা পড়লেন নেহা কক্কর-রোহনপ্রীত, সোশ্যাল মিডিয়ায় ভাইরাল বিয়ের ভিডিও",অবশেষে বিয়ে করলেন নেহা কক্কর,0
মডার্নার টিকা নিয়ে ফাউসির উচ্ছ্বাস,যুক্তরাষ্ট্রের ৪ রাজ্যে পাইলট প্রকল্পে ফাইজারের টিকা সরবরাহ শুরু,0
বলিউডের 'অ্যাডাল্ট অভিনেত্রী' খ্যাত পুনম পান্ডেকে গ্রেপ্তার করেছে ভারতীয় পুলিশ,বলিউড মডেল-অভিনেত্রী পুনমের বিরুদ্ধে মামলা,0
শ্রাবন্তীর তৃতীয় বিয়ে ভাঙার গুঞ্জনের মধ্যেই বড় ঘোষণার আভাস,কী ঘোষণার আভাস দিলেন শ্রাবন্তীর ছেলে?,0
সত্যজিত রায়ের অপু যেভাবে ফেলুদা হয়ে উঠলেন,কিংবদন্তী অভিনেতা সৌমিত্র চট্টোপাধ্যায় মারা গেছেন,0
"মুক্তি পেয়েছে আনওয়ার কা আজব কিসসা, কেমন ছিল ছবিতে কাজ করার অভিজ্ঞতা?","আত্ম অনুসন্ধানের কাহিনি ‘আনওয়ার কা আজব কিস্সা’, ছবির সেরা প্রাপ্তি নওয়াজ",0
আর্জেন্টিনাকে জেতালেন মেসি,‘মেসির বার্সায় থেকে যাওয়া আর্জেন্টিনার জন্য ইতিবাচক’,0
ছেলের মুক্তির ৩ দিন পর বাবা কারাগারে,দুর্নীতি মামলায় বিএনপি নেতা মীর নাছির কারাগারে,0
২০২১-২২ শিক্ষাবর্ষে ঢাবির ভর্তি পরীক্ষা হবে ৩ ইউনিটে,আগামী শিক্ষাবর্ষ থেকে হবে না ঢাবির 'ঘ' ও 'চ' ইউনিটের পরীক্ষা,0
২০ হাজার ভোটে পেনসিলভানিয়ায় এগিয়ে বাইডেন,"যুক্তরাষ্ট্রের নির্বাচনের ফল উদ্বেগ, উৎকণ্ঠা ও অনিশ্চিয়তার এখনও অবসান হয়নি",0
লালমনিরহাটে পুড়িয়ে হত্যা: প্রধান আসামি গ্রেফতার,অবশেষে গ্রেপ্তার প্রধান আসামি,0
মেসি বার্সায় থাকায় খুশি আর্জেন্টিনা কোচ,"বিশ্বকাপ বাছাই পর্বে গোল পেলেন মেসি, জয় পেল আর্জেন্টিনা",0
৩৫ সেকেন্ডে ধ্বংসস্তূপ তুরস্কের ইজমির,ভূমিকম্প: ১৮ ঘণ্টা পর মাসহ তিন শিশু জীবিত উদ্ধার,0
জো বাইডেনকে অভিনন্দন বিএনপির,"‘ভারতবন্ধু’বিডেনকে অভিনন্দন মোদির, বিরোধ ভুলে কমলাকেও শুভেচ্ছা বার্তা",0
"মাদক মামলায় জোর ধরপাকড়, নোটিস পাঠানো হল বিবেক ওবেরয়ের স্ত্রীকে",মাদক কারবারির খোঁজে বিবেকের বাড়িতে পুলিশ,0
"একের পর এক জায়গায় বিক্ষোভ, রেল-রাজ্য বৈঠকের দিকে তাকিয়ে যাত্রীরা","বাংলায় চালু হচ্ছে লোকাল ট্রেন পরিষেবা, কখন কোথায় কিভাবে চলবে বৈঠকে বসছে রাজ্য ও রেলকর্তারা",0
তুরস্কে ভূমিকম্পের ৬৫ ঘন্টা পর ৩ বছরের বাচ্চাকে জীবিত উদ্ধার,ভয়াবহ ভূমিকম্পে তুরস্কে নিহতের সংখ্যা বেড়ে ৯১,0
কিউইদের বিপক্ষে টি-টোয়েন্টিতে পাকিস্তানের নতুন অধিনায়কের নাম ঘোষণা,"ম্যানেজমেন্টের মানসিক অত্যাচার, অবসর ক্ষুব্ধ আমিরের",0
নাটকীয়ভাবে পুরো বোর্ড-সহ পদত্যাগ বার্সা প্রেসিডেন্টের,৩ বার বল জালে জড়িয়েও মেসিদের কাছে ২-০ গোলে হেরেছে জুভেন্টাস!,0
মুজিববর্ষের বিশেষ অধিবেশন ঘিরে সংসদে ব্যাপক প্রস্তুতি,আরো ৬ এমপি করোনায় আক্রান্ত,0
গিলগিট-বালতিস্তান ভারতেরই অংশ: ভারতের প্রতিরক্ষামন্ত্রী,ভারতের আপত্তি সত্ত্বেও গিলগিট-বালতিস্তানকে প্রদেশ ঘোষণা করলো পাকিস্তান,0
মডার্নার টিকাকে চমকপ্রদ বললেন ফাউসি ফাইল ছবি,টিকার জরুরি ব্যবহারের অনুমোদন চেয়ে আবেদন খুব শিগগিরই : ফাইজারের সিইও,0
বিজিবিতে যুক্ত হলো এয়ার উইং,সার্বভৌমত্ব রক্ষায় বিজিবি সদস্যরা এখন জলে স্থলে ও আকাশপথে বিচরণ করবেন : প্রধানমন্ত্রী,0
মিশিগানের ভোট গণনা পদ্ধতি নিয়ে তদন্তের ঘোষণা,জর্জিয়ায় ভোট পুনঃ গণনার ঘোষণা,0
চট্টগ্রামে চা বাগানের শ্রমিক হলেন নিরব-অপু!,থেমে নেই অপু বিশ্বাস,0
নেহা কক্করের মেহেদির ছবি সামনে এল,অবশেষে বিয়ে করলেন নেহা কাক্কার,0
"৬৯ রানে হার, ময়াঙ্ক আগরওয়ালের রান আউট নিয়ে কী বললেন পঞ্জাব অধিনায়ক রাহুল?","পূরাণ পারেননি, বেয়ারস্টো-ওয়ার্নারেরই জয়",0
বাইডেনের জয় এখন সময়ের ব্যাপার,প্রথম নারী ভাইস প্রেসিডেন্ট পেতে যাচ্ছে যুক্তরাষ্ট্র,0
তিন শতাধিক ইলেক্টরাল ভোটে জেতার প্রত্যাশা বাইডেনের,প্রেসিডেন্ট হয়ে যা বললেন বাইডেন,0
৫০ লাখ ছাড়ালো নিশো-মেহজাবীনের সানগ্লাস,"ভিন্ন গল্পে নিশো-মেহজাবীন, মিলছে প্রশংসা",0
"বিধি মেনে লোকাল চালাতে তৈরি, বৈঠকের আগে রাজ্যকে চিঠি পূর্ব রেলের; স্টাফ স্পেশ্যাল ট্রেনে ওঠার দাবিতে হুগলির একাধিক স্টেশনে বিক্ষোভ",রেল-রাজ্য বৈঠক: ১০-১৫ শতাংশ লোকাল ট্রেন দিয়ে শুরু হতে পারে পরিষেবা,0
ত্রিদলীয় টুর্নামেন্টের লোগো উন্মোচন ও নাম প্রকাশ,"প্রস্তুতিমূলক ওয়ানডে টুর্নামেন্টের নাম, 'বিসিবি প্রেসিডেন্টস কাপ'",0
"এই ব্লাড গ্রুপের মানুষদের করোনায় আক্রান্ত হওয়ার ঝুঁকি কম, দাবি গবেষণাপত্রে",কোন রক্তের গ্রুপে করোনা সংক্রমণের সম্ভাবনা বেশি?,0
"দায়িত্ব হারালেন আজহার, নতুন অধিনায়ক পেল পাকিস্তান",ওয়ানডেতে ব্যর্থ হলেও টি-টোয়েন্টিতে পারল পাকিস্তান,0
গোলপোস্ট কাঁপানোর দুঃখ রোনালদোর,"দারুণ খেলেও গোল পেলেন না রোনালদো, স্পেন-পর্তুগাল ম্যাচ ড্র",0
"হেটমায়ার-রাবাডার দাপট, রাজস্থানকে ৪৬ রানে হারিয়ে পয়েন্ট টেবিলের শীর্ষে দিল্লির",৬ ম্যাচে এটি পঞ্জাবের পঞ্চম হার।,0
"ট্রাম্প, নাকি বাইডেন, কে হচ্ছেন আমেরিকার ৫৯তম রাষ্ট্রপতি?","মার্কিন যুক্তরাষ্ট্রের নির্বাচন পদ্ধতি ভারতের থেকে অনেকটাই আলাদা, এক নজরে দেখে নিন কি ভাবে হয় সেখানে নির্বাচন",0
সালমার দলের কাছে জাহানারাদের এমন হার!,আইপিএলে নেমেই সৌরভ ছড়ালেন জাহানারা,0
সাত পাকে বাঁধা পড়লেন কাজল আগরওয়াল,"লাল লেহেঙ্গায় কাজল, জমকালো আয়োজনে বিয়ে",0
মেডিকেল শিক্ষার্থীদের অবরোধে পুলিশের লাঠিচার্জ,"শাহবাগে মেডিকেল শিক্ষার্থীদের আন্দোলন, তীব্র যানজট",0
তালায় ফেসবুকে স্ট্যাটাস দিয়ে ছাত্রলীগ কর্মীর আত্মহত্যা,"ছাত্রলীগের নেশাটাই আমাকে শেষ করে দিল, তাই চলে গেলাম'",0
সংখ্যালঘু নির্যাতনের প্রতিবাদে সারাদেশে বিক্ষোভ,শাহবাগ মোড়ে হিন্দু বৌদ্ধ খ্রিস্টান ঐক্য পরিষদের গণঅবস্থান,0
প্রয়াত কবি অলোকরঞ্জন,"প্রয়াত বিখ্যাত বাঙালি, নক্ষত্রপতন সংস্কৃতি জগতে",0
কাল বসছে সংসদের বিশেষ অধিবেশন,একসঙ্গে ৬ এমপি করোনায় আক্রান্ত,0
করোনায় সুস্থ ৩ কোটি ১৬ লাখ,বিশ্বব্যাপী প্রতিনিয়ত মহামারি করোনাভাইরাসে আক্রান্ত ও মৃতের সংখ্যা বাড়ছে,0
মেসি-রোনালদো মহারণ কি দেখা যাবে আজ!,জুভেন্টাসের বিপক্ষে কুতিনহোকে পাচ্ছে না বার্সা,0
সঞ্জয় দত্ত কি পারবেন ফিরতে,ক্যানসারকেও জয় করে ফিরে আসব: সঞ্জয় দত্ত,0
ত্রিপাঠি নৈপুণ্যে চেন্নাইকে হারালো কলকাতা,আবারো ব্যর্থ ধোনি; কলকাতার ঘাম ঝরানো জয়,0
রাহুলের পথ মসৃণ করতেই মনমোহনকে প্রধানমন্ত্রী করেন সোনিয়া',ওবামার স্মৃতিকথায় ভারতীয় কংগ্রেস নেতৃত্বের প্রশংসা,0
আজ রাষ্ট্রীয় শোক,বাহরাইনের প্রধানমন্ত্রীর মৃত্যু,0
"মিয়ানমারে নির্বাচন আজ, পরিবর্তনের আভাস নেই",রাখাইন রাজ্যকে বাদ দিয়েই মিয়ানমারে সাধারণ নির্বাচন,0
এবার অস্ট্রিয়ায় বন্ধ করে দেওয়া হচ্ছে মসজিদ,"দ্বৈত নাগরিকত্ব নিয়ে জেহাদি কার্যকলাপ, ভিয়েনায় সন্ত্রাসবাদী হামলায় গ্রেপ্তার ১ বাংলাদেশি",0
নামাজ পড়তে পারেন না বলে অভিনয় ছেড়ে দিলেন বাংলাদেশি নায়িকা,নামাজ পড়তে অসুবিধা হয় বলে অভিনয় ছেড়েছি',0
সানরাইজার্সের কাছে কার্যত আত্মসমর্পণ করে কিংস ইলেভেন পঞ্জাব।,ত্রিপাঠিকে ওপেনিংয়ে পাঠিয়েই কলকাতার বাজিমাত,0
যেভাবে ঘাপটি মেরে ছিলেন এসআই আকবর,এসআই আকবর ধরা পড়ার ভিডিও ভাইরাল,0
জয়ের দ্বারপ্রান্তে বাইডেন,যুক্তরাষ্ট্রের ৪৬তম প্রেসিডেন্ট বাইডেন,0
বার্সায় চুক্তির মেয়াদ বাড়াতে মেসিকে বেতন কমাতে হবে',মেসিকে বেঞ্চে রাখার ব্যাখ্যা দিলেন কোমান,0
"চট্টগ্রামে নামতে পারে বৃষ্টি, এরপর জেঁকে বসবে শীত",দেশের যেসব অঞ্চলে আজ বৃষ্টি হতে পারে,0
জানা গেল শার্লিন ফারজানার অন্তরালের গল্প,মা হলেন অভিনেত্রী শার্লিন ফারজানা,0
"করোনায় আরও ১৮ জনের মৃত্যু, শনাক্ত ১৪৭৪","করোনায় মৃত্যু কমেছে, বেড়েছে শনাক্ত-সুস্থের সংখ্যা",0
অনুশীলনে আহত ইফতেখার চৌধুরীর নতুন নায়িকা,মোটরসাইকেল চালাতে গিয়ে গুরুতর আহত নায়িকা রাজ রিপা,0
৩০০ ইলেকটোরাল কলেজ ভোটের আশা বাইডেনের,বাইডেন জর্জিয়া এবং পেনসিলভেনিয়ায় এগিয়ে আছেন,0
নতুন বিতর্কে সৃজিত-মিথিলা,অষ্টমীর অঞ্জলি দিতে গিয়ে আইনি জটিলতায় সৃজিত-মিথিলা,0
সৌমিত্রের মৃত্যুতে অভিনয় জগতে বিশাল শূন্যতার সৃষ্টি হলো,রেডিওর ঘোষক থেকে বাংলা সিনেমার কিংবদন্তি সৌমিত্র,0
ট্রাম্পের চেয়ে ১০ পয়েন্ট এগিয়ে বাইডেন,গুরুত্বপূর্ণ চার রাজ্যে এগিয়ে বাইডেন,0
নির্বাচনের আগেই 'গণতন্ত্রের জীবনীশক্তি খর্ব' করছে মিয়ানমার,"কাল মিয়ানমারে জাতীয় নির্বাচন, রোহিঙ্গারা বঞ্চিত",0
"ফাইজারের ভ্যাকসিন ৯৫ শতাংশ কার্যকর, শিগগিরই অনুমোদনের আবেদন",টিকা নিরাপদ বলে যথেষ্ট প্রমাণ পাওয়া গেছে: ফাইজার,0
"ভারতীয় মায়ের কৃষ্ণাঙ্গ মেয়ে হোয়াইট ‘হাউসে’, ইতিহাসে ঢুকলেন কমলা হ্যারিস",এর চেয়ে গর্বের আর কিছু নেই: ওবামা,0
নির্বাচনের সদ্য পাওয়া খবর,"আমরা পেরেছি জো, আমরা পেরেছি: কমলার ভিডিও ভাইরাল",0
"আইপিএল ২০২০: ব্যাটে সেরা রাহুল, বলে রাবাদা",শিরোপা থাকলো মুম্বাইয়ের ঘরেই,0
চঞ্চল ও শাওনের গাওয়া গান–বিতর্ক: কে কী বলছেন,‘সর্বত মঙ্গল রাধে’ গান নিয়ে বিতর্কে যা বললেন চঞ্চল চৌধুরী,0
রায়হান হত্যা মামলার মূল আসামি এসআই আকবর গ্রেপ্তার,যেভাবে ধরা খেলেন সেই আকবর,0
বিশ্বব্যাপী করোনা আক্রান্ত ৪ কোটি ৬০ লাখ,সর্বনাশা করোনা: মৃত্যু ১২ লাখ ছাড়াল,0
সীমান্ত পাহারায় দুটি হেলিকপ্টার পাচ্ছে বিজিবি,বিজিবি সদস্যরা এখন জলে স্থলে ও আকাশপথে বিচরণ করবেন: প্রধানমন্ত্রী,0
ওয়েব সিরিজে ফেলুদা ফেরত,"শীতের মরসুমেই আসছে ফেলুদা, পোস্টার সামনে আসতেই উত্তেজনার পারদ তুঙ্গে, সৃজিতের হাতে স্বাদবদল",0
অভিষেকেই নিউজিল্যান্ডকে জেতালেন ডাফি,কিউইদের কাছে ৫ উইকেটে হারল বাবরবিহীন পাকিস্তান,0
"নোয়াখালীতে চাচীকে ধর্ষণ করে নগ্ন ছবি ধারণ, যুবলীগ নেতা গ্রেফতার",ধর্ষণের দায়ে গ্রেপ্তার যুবলীগ নেতার ঘর থেকে অস্ত্র উদ্ধার,0
ববিতার কষ্ট দূর করতে ঈদের আয়োজন করেছিলেন সৌমিত্র চট্টোপাধ্যায়,তিনি ছিলেন বাংলা ছবির অভিভাবক: ববিতা,0
বিহারে ছয়বারের মুখ্যমন্ত্রী নীতিশ কুমার আবারও শপথ নিলেন,কেন বিহারের মন্ত্রিসভায় নেই সুশীল মোদি?,0
কে এই জো বাইডেন,হোয়াইট হাউসের পথে অনেক এগিয়ে বাইডেন,0
নতুন ইনিংসের ঘোষণা দিলেন শ্রাবন্তী,মায়ের সংসার ভাঙার গুঞ্জনে শ্রাবন্তীর ছেলে ঝিনুকের রহস্য!,0
কিছুটা স্থিতিশীল বর্ষীয়ান অভিনেতা সৌমিত্র চট্টোপাধ্যায়ের শারীরিক অবস্থা।,"খুব বেশি আশা করা যাবে না, সৌমিত্রর শারীরিক অবস্থা নিয়ে বললেন তাঁর চিকিৎসক",0
